{
  "schema_version": 2,
  "kind": "phase-8-verification",
  "template_digest": {
    "algorithm": "sha256-canonical-json-v1",
    "value": "a92b7ce00c41e3bf35bb37b51fb476875dec8ae4d18e6bf2141cd2cd895a9dba"
  },
  "source_identity": "contract-gallery:source-blind",
  "build_identity": "workbench-shell-contracts-20260927-23",
  "browser_identity": "Chromium 141.0.7390.54",
  "records": [
    {
      "id": "0e198063-b3b3-513d-8f8a-85eaf3d84fd9",
      "rule_id": "QUALITY-104",
      "status": "passed",
      "expected": {
        "backgroundColor": "oklch(0.21 0.006 285.885)",
        "color": "oklch(0.985 0 0)",
        "borderColor": "rgba(0, 0, 0, 0)",
        "height": "32px",
        "borderRadius": "10px"
      },
      "actual": {
        "backgroundColor": "oklch(0.21 0.006 285.885)",
        "color": "oklch(0.985 0 0)",
        "borderColor": "rgba(0, 0, 0, 0)",
        "height": "32px",
        "borderRadius": "10px"
      },
      "route": "/dev/design-system",
      "viewport": "desktop",
      "theme": "light",
      "state": "ready",
      "scenario_ids": [
        "phase8:variant:primitive/button:default"
      ],
      "evidence_refs": [
        "evidence/contract-gallery.json",
        "evidence/contract-gallery.png"
      ]
    },
    {
      "id": "a7a2f244-bbf9-55e9-8c7d-94338725fb85",
      "rule_id": "QUALITY-104",
      "status": "passed",
      "expected": {
        "backgroundColor": "oklch(1 0 0)",
        "color": "oklch(0.141 0.005 285.823)",
        "borderColor": "oklch(0.92 0.004 286.32)",
        "height": "32px",
        "borderRadius": "10px"
      },
      "actual": {
        "backgroundColor": "oklch(1 0 0)",
        "color": "oklch(0.141 0.005 285.823)",
        "borderColor": "oklch(0.92 0.004 286.32)",
        "height": "32px",
        "borderRadius": "10px"
      },
      "route": "/dev/design-system",
      "viewport": "desktop",
      "theme": "light",
      "state": "ready",
      "scenario_ids": [
        "phase8:variant:primitive/button:outline"
      ],
      "evidence_refs": [
        "evidence/contract-gallery.json",
        "evidence/contract-gallery.png"
      ]
    },
    {
      "id": "9eb69772-63c0-5791-9daf-357c7fde8055",
      "rule_id": "QUALITY-104",
      "status": "passed",
      "expected": {
        "backgroundColor": "oklch(0.55 0.16 255)",
        "color": "oklch(0.985 0 0)",
        "borderColor": "rgba(0, 0, 0, 0)",
        "height": "32px",
        "borderRadius": "10px"
      },
      "actual": {
        "backgroundColor": "oklch(0.55 0.16 255)",
        "color": "oklch(0.985 0 0)",
        "borderColor": "rgba(0, 0, 0, 0)",
        "height": "32px",
        "borderRadius": "10px"
      },
      "route": "/dev/design-system",
      "viewport": "desktop",
      "theme": "light",
      "state": "ready",
      "scenario_ids": [
        "phase8:variant:primitive/button:brand"
      ],
      "evidence_refs": [
        "evidence/contract-gallery.json",
        "evidence/contract-gallery.png"
      ]
    },
    {
      "id": "6687f204-f4bc-542c-8cb0-a6189e1a8a50",
      "rule_id": "QUALITY-104",
      "status": "passed",
      "expected": {
        "backgroundColor": "oklch(0.967 0.001 286.375)",
        "color": "oklch(0.141 0.005 285.823)",
        "borderColor": "oklch(0.92 0.004 286.32)",
        "height": "32px",
        "borderRadius": "10px"
      },
      "actual": {
        "backgroundColor": "oklch(0.967 0.001 286.375)",
        "color": "oklch(0.141 0.005 285.823)",
        "borderColor": "oklch(0.92 0.004 286.32)",
        "height": "32px",
        "borderRadius": "10px"
      },
      "route": "/dev/design-system",
      "viewport": "desktop",
      "theme": "light",
      "state": "ready",
      "scenario_ids": [
        "phase8:variant:primitive/button:secondary"
      ],
      "evidence_refs": [
        "evidence/contract-gallery.json",
        "evidence/contract-gallery.png"
      ]
    },
    {
      "id": "34512cef-7a9b-5774-893e-dbc924f14784",
      "rule_id": "QUALITY-104",
      "status": "passed",
      "expected": {
        "backgroundColor": "rgba(0, 0, 0, 0)",
        "color": "oklch(0.141 0.005 285.823)",
        "borderColor": "rgba(0, 0, 0, 0)",
        "height": "32px",
        "borderRadius": "10px"
      },
      "actual": {
        "backgroundColor": "rgba(0, 0, 0, 0)",
        "color": "oklch(0.141 0.005 285.823)",
        "borderColor": "rgba(0, 0, 0, 0)",
        "height": "32px",
        "borderRadius": "10px"
      },
      "route": "/dev/design-system",
      "viewport": "desktop",
      "theme": "light",
      "state": "ready",
      "scenario_ids": [
        "phase8:variant:primitive/button:ghost"
      ],
      "evidence_refs": [
        "evidence/contract-gallery.json",
        "evidence/contract-gallery.png"
      ]
    },
    {
      "id": "2b288620-f7c4-5acb-bc5a-901d5cc3fee9",
      "rule_id": "QUALITY-104",
      "status": "passed",
      "expected": {
        "backgroundColor": "oklab(0.577 0.217662 0.112464 / 0.1)",
        "color": "oklch(0.577 0.245 27.325)",
        "borderColor": "rgba(0, 0, 0, 0)",
        "height": "32px",
        "borderRadius": "10px"
      },
      "actual": {
        "backgroundColor": "oklab(0.577 0.217662 0.112464 / 0.1)",
        "color": "oklch(0.577 0.245 27.325)",
        "borderColor": "rgba(0, 0, 0, 0)",
        "height": "32px",
        "borderRadius": "10px"
      },
      "route": "/dev/design-system",
      "viewport": "desktop",
      "theme": "light",
      "state": "ready",
      "scenario_ids": [
        "phase8:variant:primitive/button:destructive"
      ],
      "evidence_refs": [
        "evidence/contract-gallery.json",
        "evidence/contract-gallery.png"
      ]
    },
    {
      "id": "a9030279-595d-5ced-8ad2-6db40fd1aa6b",
      "rule_id": "QUALITY-104",
      "status": "passed",
      "expected": {
        "backgroundColor": "rgba(0, 0, 0, 0)",
        "color": "oklch(0.21 0.006 285.885)",
        "borderColor": "rgba(0, 0, 0, 0)",
        "height": "32px",
        "borderRadius": "10px"
      },
      "actual": {
        "backgroundColor": "rgba(0, 0, 0, 0)",
        "color": "oklch(0.21 0.006 285.885)",
        "borderColor": "rgba(0, 0, 0, 0)",
        "height": "32px",
        "borderRadius": "10px"
      },
      "route": "/dev/design-system",
      "viewport": "desktop",
      "theme": "light",
      "state": "ready",
      "scenario_ids": [
        "phase8:variant:primitive/button:link"
      ],
      "evidence_refs": [
        "evidence/contract-gallery.json",
        "evidence/contract-gallery.png"
      ]
    },
    {
      "id": "b8481f3d-5eb2-51f6-822b-929f91493f2f",
      "rule_id": "LAYOUT-103",
      "status": "passed",
      "expected": {
        "slot": "icon",
        "order": 0,
        "visible": true
      },
      "actual": {
        "slot": "icon",
        "order": 0,
        "visible": true
      },
      "route": "/dev/design-system",
      "viewport": "desktop",
      "theme": "light",
      "state": "ready",
      "scenario_ids": [
        "phase8:anatomy:primitive/app-sidebar:icon:0"
      ],
      "evidence_refs": [
        "evidence/contract-gallery.json",
        "evidence/contract-gallery.png"
      ]
    },
    {
      "id": "2fa22975-9cfd-54f6-bcf1-1b367cb2cff5",
      "rule_id": "LAYOUT-103",
      "status": "passed",
      "expected": {
        "slot": "label",
        "order": 1,
        "visible": true
      },
      "actual": {
        "slot": "label",
        "order": 1,
        "visible": true
      },
      "route": "/dev/design-system",
      "viewport": "desktop",
      "theme": "light",
      "state": "ready",
      "scenario_ids": [
        "phase8:anatomy:primitive/app-sidebar:label:1"
      ],
      "evidence_refs": [
        "evidence/contract-gallery.json",
        "evidence/contract-gallery.png"
      ]
    },
    {
      "id": "477a25fb-a7fb-598d-91ff-dbe81a9b2f7d",
      "rule_id": "LAYOUT-103",
      "status": "passed",
      "expected": {
        "slot": "badge",
        "order": 2,
        "visible": true
      },
      "actual": {
        "slot": "badge",
        "order": 2,
        "visible": true
      },
      "route": "/dev/design-system",
      "viewport": "desktop",
      "theme": "light",
      "state": "ready",
      "scenario_ids": [
        "phase8:anatomy:primitive/app-sidebar:badge:2"
      ],
      "evidence_refs": [
        "evidence/contract-gallery.json",
        "evidence/contract-gallery.png"
      ]
    },
    {
      "id": "f07aa7ed-e810-5281-be51-b1689716bb27",
      "rule_id": "LAYOUT-103",
      "status": "passed",
      "expected": {
        "slot": "shortcut",
        "order": 3,
        "visible": true
      },
      "actual": {
        "slot": "shortcut",
        "order": 3,
        "visible": true
      },
      "route": "/dev/design-system",
      "viewport": "desktop",
      "theme": "light",
      "state": "ready",
      "scenario_ids": [
        "phase8:anatomy:primitive/app-sidebar:shortcut:3"
      ],
      "evidence_refs": [
        "evidence/contract-gallery.json",
        "evidence/contract-gallery.png"
      ]
    },
    {
      "id": "a1f17929-bcb2-5877-b9a5-2e702646f11c",
      "rule_id": "LAYOUT-103",
      "status": "passed",
      "expected": {
        "slot": "trailing",
        "order": 4,
        "visible": true
      },
      "actual": {
        "slot": "trailing",
        "order": 4,
        "visible": true
      },
      "route": "/dev/design-system",
      "viewport": "desktop",
      "theme": "light",
      "state": "ready",
      "scenario_ids": [
        "phase8:anatomy:primitive/app-sidebar:trailing:4"
      ],
      "evidence_refs": [
        "evidence/contract-gallery.json",
        "evidence/contract-gallery.png"
      ]
    },
    {
      "id": "5ef0925c-41d8-5877-8588-f19d0cc13a0f",
      "rule_id": "LAYOUT-103",
      "status": "passed",
      "expected": {
        "slot": "icon",
        "order": 0,
        "visible": true
      },